{
  "contract": "helianthus.gateway.portal-catalog/v1",
  "catalog_revision": "aaaaaaaaaaaaaaaaaaaaaaaaaaaaaaaaaaaaaaaaaaaaaaaaaaaaaaaaaaaaaaaa",
  "catalog_digest": "bbbbbbbbbbbbbbbbbbbbbbbbbbbbbbbbbbbbbbbbbbbbbbbbbbbbbbbbbbbbbbbb",
  "evaluation_instant": "2026-09-11T00:00:00Z",
  "domains": [
    {"pack":{"id":"helianthus.pack.evse","version":"1.0.0"},"source_state":"ABSENT","reason":"source_unavailable"},
    {"pack":{"id":"helianthus.pack.infrastructure","version":"1.0.0"},"source_state":"ABSENT","reason":"source_unavailable"},
    {"pack":{"id":"helianthus.pack.pv","version":"1.0.0"},"source_state":"PRESENT"},
    {"pack":{"id":"helianthus.pack.storage","version":"1.1.0"},"source_state":"ABSENT","reason":"source_unavailable"},
    {"pack":{"id":"helianthus.pack.thermal","version":"1.0.0"},"source_state":"ABSENT","reason":"source_unavailable"}
  ],
  "contributions": [], "descriptors": [], "resources": [], "fields": [], "actions": [], "quarantines": []
}
